### ISSUE TITLE
InfluxDB won't start because of collectd configurations

### ISSUE THREAD

**Issue by BentCoder** [influxdata/influxdb#8812]
When I install/use collectd and influxdb on same server, influxdb starts which is fine. However, when I have them installed on different servers, influxdb won't start **but** If I disable collectd config in influxdb configuration file, influxdb seems to be starting fine again. Sounds like, influxdb doesn't like collectd configs.

What could be the solution?

_Note_: Both servers are vagrant boxes. I removed and reinstalled InfluxDB but no joy.

**Server 1** - where `collectd 5.5.1` is running
OS: Ubuntu 16:04
IP: 192.168.50.20

**Server 2** - where `influxdb 1.3.5` is running
OS: Ubuntu 16:04
IP: 192.168.99.30

**COLLECTD config (SERVER 1)**
```
LoadPlugin cpu
LoadPlugin disk
LoadPlugin load
LoadPlugin memory
LoadPlugin processes
LoadPlugin swap
LoadPlugin users

LoadPlugin network
<Plugin "network">
Server "192.168.99.30" "25826"
</Plugin>
```

**INFLUXDB config (SERVER 2)**
```
[[collectd]]
  enabled = true
  bind-address = ":25826" # I tried "192.168.99.30:25826" as well
  database = "collectd"
  typesdb = "/usr/share/collectd/types.db"
```

**INFLUXDB ERROR  (SERVER 2)**
```
server2:~$ sudo service influxdb stop
server2:~$ sudo service influxdb start
server2:~$ sudo service influxdb status

● influxdb.service - InfluxDB is an open-source, distributed, time series database
   Loaded: loaded (/lib/systemd/system/influxdb.service; enabled; vendor preset: enabled)
   Active: inactive (dead) (Result: exit-code) since Sat 2017-09-09 09:45:24 UTC; 3s ago
     Docs: https://docs.influxdata.com/influxdb/
  Process: 3895 ExecStart=/usr/bin/influxd -config /etc/influxdb/influxdb.conf ${INFLUXD_OPTS} (code=exited, status=1/FAILURE)
 Main PID: 3895 (code=exited, status=1/FAILURE)

Sep 09 09:45:24 php7 systemd[1]: influxdb.service: Main process exited, code=exited, status=1/FAILURE
Sep 09 09:45:24 php7 systemd[1]: influxdb.service: Unit entered failed state.
Sep 09 09:45:24 php7 systemd[1]: influxdb.service: Failed with result 'exit-code'.
Sep 09 09:45:24 php7 systemd[1]: influxdb.service: Service hold-off time over, scheduling restart.
Sep 09 09:45:24 php7 systemd[1]: Stopped InfluxDB is an open-source, distributed, time series database.
Sep 09 09:45:24 php7 systemd[1]: influxdb.service: Start request repeated too quickly.
Sep 09 09:45:24 php7 systemd[1]: Failed to start InfluxDB is an open-source, distributed, time series database.
```

**INFLUXDB INFORMATION  (SERVER 2)**
```
server2:~$ influxd -config /etc/influxdb/influxdb.conf

 8888888           .d888 888                   8888888b.  888888b.
   888            d88P"  888                   888  "Y88b 888  "88b
   888            888    888                   888    888 888  .88P
   888   88888b.  888888 888 888  888 888  888 888    888 8888888K.
   888   888 "88b 888    888 888  888  Y8bd8P' 888    888 888  "Y88b
   888   888  888 888    888 888  888   X88K   888    888 888    888
   888   888  888 888    888 Y88b 888 .d8""8b. 888  .d88P 888   d88P
 8888888 888  888 888    888  "Y88888 888  888 8888888P"  8888888P"

[I] 2017-09-09T09:47:31Z InfluxDB starting, version 1.3.5, branch HEAD, commit 9d9001036d3585cf21925c13a57881bc6c8dcc7e
[I] 2017-09-09T09:47:31Z Go version go1.8.3, GOMAXPROCS set to 2
[I] 2017-09-09T09:47:31Z Using configuration at: /etc/influxdb/influxdb.conf
[I] 2017-09-09T09:47:31Z Using data dir: /var/lib/influxdb/data service=store
run: open server: open tsdb store: open /var/lib/influxdb/data/_internal: permission denied
```

**INFLUXDB PERMISSIONS  (SERVER 2)**
```
server2:~$ ls -l /var/lib/influxdb/
drwxr-xr-x 4 influxdb influxdb 4096 Sep  8 14:12 data
drwxr-xr-x 2 influxdb influxdb 4096 Sep  9 08:20 meta
drwx------ 4 influxdb influxdb 4096 Sep  8 14:12 wal

server2:~$ ls -l /var/lib/influxdb/data/
drwx------ 3 influxdb influxdb 4096 Sep  8 13:19 _internal
drwx------ 3 influxdb influxdb 4096 Sep  8 14:12 server_stats

server2:~$ ls -l /var/lib/influxdb/data/_internal/
ls: cannot open directory '/var/lib/influxdb/data/_internal/': Permission denied

server2:~$ sudo ls -l /var/lib/influxdb/data/_internal/
drwx------ 4 influxdb influxdb 4096 Sep  9 07:31 monitor
```

**UPD TEST  (SERVER 1)**
```
server1:~$ sudo tcpdump -i eth0 -p -n dst port 25826
tcpdump: verbose output suppressed, use -v or -vv for full protocol decode
listening on eth0, link-type EN10MB (Ethernet), capture size 65535 bytes
10:52:34.138885 IP 10.0.2.15.34237 > 192.168.99.30.25826: UDP, length 1297
10:52:44.137505 IP 10.0.2.15.34237 > 192.168.99.30.25826: UDP, length 1319
10:52:54.138522 IP 10.0.2.15.34237 > 192.168.99.30.25826: UDP, length 1301
10:53:04.137666 IP 10.0.2.15.34237 > 192.168.99.30.25826: UDP, length 1298
....
```

**Comment by BentCoder** [comment]
This is all about the `typesdb` property. Do the following to solve problem.

```
server-2:~$ sudo mkdir /usr/local/share/collectd
server-2:~$ sudo wget -P /usr/local/share/collectd https://raw.githubusercontent.com/collectd/collectd/master/src/types.db
```

That's it!

**Comment by crazy-canux** [comment]
I got the same problem, even types.db already exist.

Jan 22 21:32:16 maf influxd[27292]: [I] 2018-01-23T02:32:16Z InfluxDB starting, version 1.4.2, branch 1.4, commit 6d2685d1738277a1c2672fc58df7994627769be6
Jan 22 21:32:16 maf influxd[27292]: [I] 2018-01-23T02:32:16Z Go version go1.9.2, GOMAXPROCS set to 8
Jan 22 21:32:16 maf influxd[27292]: [I] 2018-01-23T02:32:16Z Using configuration at: /etc/influxdb/influxdb.conf
Jan 22 21:32:16 maf systemd[1]: influxdb.service: Main process exited, code=exited, status=1/FAILURE
Jan 22 21:32:16 maf systemd[1]: influxdb.service: Unit entered failed state.
Jan 22 21:32:16 maf systemd[1]: influxdb.service: Failed with result 'exit-code'.
Jan 22 21:32:17 maf systemd[1]: influxdb.service: Service hold-off time over, scheduling restart.
Jan 22 21:32:17 maf systemd[1]: Stopped InfluxDB is an open-source, distributed, time series database.
-- Subject: Unit influxdb.service has finished shutting down
-- Defined-By: systemd
-- Support: http://lists.freedesktop.org/mailman/listinfo/systemd-devel
--
-- Unit influxdb.service has finished shutting down.
Jan 22 21:32:17 maf systemd[1]: influxdb.service: Start request repeated too quickly.
Jan 22 21:32:17 maf systemd[1]: Failed to start InfluxDB is an open-source, distributed, time series database.
-- Subject: Unit influxdb.service has failed
-- Defined-By: systemd
-- Support: http://lists.freedesktop.org/mailman/listinfo/systemd-devel
--
-- Unit influxdb.service has failed.
--
-- The result is failed.

Can someone help me?
