### ISSUE TITLE
Default on reporting usage data should be disabled if truly 'optional'

### ISSUE THREAD

**Issue by earies** [influxdata/influxdb#20425]
https://github.com/influxdata/influxdb/issues/9497 outlined making usage reporting optional however I think there is a disconnect on what "optional" means.  If something is optional then it should be up to the user to "opt-in" and not rather "opt-out".  I consider this shady practice to say the least.  On top of this is bypassing any local DNS configuration to make use of public `8.8.8.8` DNS resolvers.

From `influxdb.conf`

```
# Once every 24 hours InfluxDB will report usage data to usage.influxdata.com
# The data includes a random ID, os, arch, version, the number of series and other
# usage data. No data from user databases is ever transmitted.
# Change this option to true to disable reporting.
# reporting-disabled = false
```

__Steps to reproduce:__
List the minimal actions needed to reproduce the behavior.

1. Launch `influxd`
2. See the outbound TCP/TLS connection establish to `usage.influxdata.com`

__Expected behavior:__
Describe what you expected to happen.

Default on reporting data should be opt-in vs. opt-out

__Actual behavior:__
Describe What actually happened.

Unless explicitly disabled by the user, outbound TCP/TLS connections are established to `usage.influxdata.com`

__Environment info:__

* System info: `Linux 5.10.0-rc5-20201127.1135MST x86_64`
* InfluxDB version: InfluxDB v1.8.3 (git: 1.8 563e6c3d1a7a2790763c6289501095dbec19244e)
* Other relevant environment details: docker image `influxdb:latest`

__Config:__
Copy any non-default config values here or attach the full config as a gist or file.

__Logs:__

```
13:08:47.984517 IP 172.27.0.2.51878 > 8.8.8.8.53: 64835+ AAAA? usage.influxdata.com. (38)
13:08:47.984517 IP 172.27.0.2.41820 > 8.8.8.8.53: 35092+ A? usage.influxdata.com. (38)
13:08:48.004282 IP 8.8.8.8.53 > 172.27.0.2.51878: 64835 1/1/0 CNAME d3nj60yw3f0wsq.cloudfront.net. (165)
13:08:48.033886 IP 8.8.8.8.53 > 172.27.0.2.41820: 35092 5/0/0 CNAME d3nj60yw3f0wsq.cloudfront.net., A 65.8.233.42, A 65.8.233.94, A 65.8.233.110, A 65.8.233.38 (145)
```

__Performance:__
Generate profiles with the following commands for bugs related to performance, locking, out of memory (OOM), etc.

**Comment by russorat** [comment]
@earies thank you for the issue. We do not plan to change this default. Please continue to disable the reporting using the config option provided.
